url,titulo,descricao,categoria,data,grupo,grupo3,texto_limpo,n_tokens,n_unicos,topico_lda
https://motor1.uol.com.br/news/794474/gwm-tank-300-flex-aovivo/,Conhecemos: Tank 300 Flex é destaque da GWM durante Agrishow,"SUV médio grande agora também pode ser abastecido com etanol, mas potência não muda; confira detalhes, motorização e preço.",Análise,2026-04-29T19:41:08+00:00,Combustão,Combustão/Híbrido,conhecemos tank flex destaque gwm durante agrishow suv medio grande agora abastecido etanol potencia muda confira detalhes motorizacao,18,18,3
https://motor1.uol.com.br/news/794454/mercedesbenz-gla-glb-night-edition/,Mercedes-Benz oficializa chegada dos GLA e GLB Night Edition,"Mercedes-Benz lança série Night Edition para SUVs GLA 200 e GLB 220 no Brasil. Confira o visual, as novas cores e os detalhes técnicos de cada modelo.",Análise,2026-04-29T16:49:53+00:00,Geral,Geral,mercedes benz oficializa chegada gla glb night edition mercedes benz lanca serie night edition suvs gla glb confira visual novas cores detalhes tecnicos cada,24,18,1
https://motor1.uol.com.br/news/794441/bmw-brasil-confirma-m4-competition/,BMW confirma M4 Competition no Brasil ainda no primeiro semestre,"A BMW confirmou a chegada do M4 Competition ao Brasil no primeiro semestre de 2026. Cupê tem motor biturbo de 510 cv, 66,2 kgfm e faz 0-100 km/h em 3,9s.",Análise,2026-04-29T15:11:16+00:00,Geral,Geral,bmw confirma competition ainda primeiro semestre bmw confirmou chegada competition primeiro semestre cupe biturbo kgfm faz,16,12,4
https://motor1.uol.com.br/news/794430/mais-vendidos-abril-previa-fenabrave-brasil/,Mais vendidos: Fiat Strada lidera abril e BYD Dolphin Mini avança,"Prévia da Fenabrave até dia 28 mostra Polo na liderança, Strada isolada e avanço do Dolphin Mini entre os mais vendidos.",Análise,2026-04-29T13:53:06+00:00,Elétrico,Elétrico,vendidos fiat strada lidera abril byd dolphin mini avanca previa fenabrave dia mostra polo lideranca strada isolada avanco dolphin mini vendidos,21,17,2
https://motor1.uol.com.br/news/794354/hyundai-ioniq-v-seda-pequim/,Hyundai Ioniq V: um sedã de outro planeta para conquistar o mercado chinês,"Conheça o Ioniq V, o sedã elétrico da Hyundai que parou o Salão de Pequim. Com visual de Lamborghini e 600 km de autonomia, ele é aposta para vencer a BYD.",Análise,2026-04-29T12:01:19+00:00,Elétrico,Elétrico,hyundai ioniq seda outro planeta conquistar chines conheca ioniq seda eletrico hyundai parou salao pequim visual lamborghini autonomia aposta vencer byd,21,18,1
https://motor1.uol.com.br/news/794353/vw-idpolo-lancamento-europa-eletrico/,Volkswagen ID. Polo 2027: ,"Com interior focado na usabilidade e visual retrô, hatch elétrico prova que a VW consegue encarar rivais chineses, mas modelo não deve chegar ao Brasil.",Análise,2026-04-29T10:01:05+00:00,Elétrico,Elétrico,volkswagen polo interior focado usabilidade visual retro hatch eletrico prova consegue encarar rivais chineses deve chegar,16,16,2
https://motor1.uol.com.br/news/794351/omoda-jaecoo-producao-nacional-2027/,Omoda & Jaecoo quer produzir no Brasil em 2027; Omoda 5 e Jaecoo 5 cotados,"Omoda & Jaecoo planeja produzir no Brasil em 2027, com Omoda 5 e Jaecoo 5 cotados. Fábrica será em Itatiaia (RJ), ex-Jaguar Land Rover.",Análise,2026-04-28T23:22:12+00:00,Geral,Geral,omoda jaecoo quer produzir omoda jaecoo cotados omoda jaecoo planeja produzir omoda jaecoo cotados fabrica itatiaia jaguar land rover,19,11,2
https://motor1.uol.com.br/news/794339/chevrolet-s10-trail-boss-trailblazer-midnight-agrishow-2026/,Chevrolet lança S10 Trail Boss e Trailblazer Midnight na Agrishow 2026,"Com suspensão Ironman e visual estilizado, picape média e SUV de 7 lugares estreiam novas versões com proposta fora-de-estrada na maior feira agro do País.",Análise,2026-04-28T21:30:00+00:00,Geral,Geral,chevrolet lanca trail boss trailblazer midnight agrishow suspensao ironman visual estilizado picape media suv lugares estreiam novas proposta estrada maior feira agro pais,23,23,5
https://motor1.uol.com.br/news/794299/gwm-haval-h7-tank-400-novos-suvs-brasil/,GWM planeja lançar dois SUVs inéditos no Brasil ainda em 2026,Haval H7 e Tank 400 chegam no segundo semestre para ampliar portfólio da marca chinesa e atacar desde a faixa dos R$ 300 mil até o território premium.,Análise,2026-04-28T19:00:00+00:00,Geral,Geral,gwm planeja lancar dois suvs ineditos ainda haval tank chegam segundo semestre ampliar portfolio chinesa atacar desde faixa mil territorio premium,21,21,3
https://motor1.uol.com.br/news/794230/byd-denza-picape-caminhao-agrishow/,"BYD mostra picape Mako, esportivo da Denza e caminhão na Agrishow 2026",BYD apresenta o protótipo da picape Mako e a marca premium Denza na Agrishow 2026. Veja também o preço especial da Shark para produtores rurais.,Análise,2026-04-28T17:26:47+00:00,Elétrico,Elétrico,byd mostra picape mako esportivo denza caminhao agrishow byd apresenta prototipo picape mako premium denza agrishow especial shark produtores rurais,20,15,5
https://motor1.uol.com.br/news/794229/mitsubishi-lanca-triton2027-especial-terra/,Mitsubishi Triton Terra 2027 resgata série especial com foco no agro de luxo,"Com apenas 300 unidades, edição limitada aposta em acabamento bicolor e caçamba com revestimento em poliureia.",Análise,2026-04-28T12:00:00+00:00,Geral,Geral,mitsubishi triton terra resgata serie especial foco agro luxo apenas edicao limitada aposta acabamento bicolor cacamba revestimento poliureia,18,18,5
https://motor1.uol.com.br/news/794224/honda-lanca-nova-pop-2027/,"Nova Honda Pop 110i 2027 segue Biz, perde freio no pé e muda visual pela primeira vez desde 2007","Moto mais barata da marca, Honda Pop já passou das 2,2 mi unidades produzidas e se renova após quase duas décadas, seguindo estratégia da Biz.",Análise,2026-04-28T11:07:57+00:00,Geral,Geral,honda pop segue biz perde freio muda visual primeira vez desde moto barata honda pop passou produzidas renova apos quase duas decadas seguindo estrategia biz,25,22,3
https://motor1.uol.com.br/news/794225/vendas-alemanha-tesla-lider-ranking/,Alemanha em março: VW lidera e Tesla Model Y é o 2º mais vendido,"Ranking dos carros mais vendidos da Alemanha mostra preferência por marcas locais, com ampla liderança da Volkswagen; mas a Tesla quadruplicou vendas.",Análise,2026-04-28T10:00:00+00:00,Elétrico,Elétrico,alemanha marco lidera tesla model vendido ranking vendidos alemanha mostra preferencia locais ampla lideranca volkswagen tesla quadruplicou,17,15,4
https://motor1.uol.com.br/news/794087/jaecoo-5-brasil-data-preco/,Novo Jaecoo 5 chega ao Brasil em julho e preço pode partir de R$ 150 mil,Novo SUV da Omoda & Jaecoo será híbrido e poderá oferecer duas versões.,Análise,2026-04-27T22:52:19+00:00,Elétrico,Elétrico,jaecoo chega julho partir mil suv omoda jaecoo hibrido podera oferecer duas,12,11,5
https://motor1.uol.com.br/news/794082/novo-omoda-4-especificacoes-brasil/,Novo Omoda 4: o que traz o SUV mais barato da marca que chega ao Brasil ainda em 2026,"SUV de entrada da Omoda & Jaecoo, Omoda 4 segue visual ousado, mas com pacote mais simples para atuar abaixo do Omoda 5.",Análise,2026-04-26T18:41:29+00:00,Geral,Geral,omoda traz suv barato chega ainda suv entrada omoda jaecoo omoda segue visual ousado pacote simples atuar abaixo omoda,19,15,5
https://motor1.uol.com.br/news/794091/gwm-ora-03-reestilizado-china/,"Ora 03 reestilizado estreia em Pequim, mas Brasil terá antes o Ora 5","Hatch elétrico da GWM ganha mudanças discretas no visual e nova cabine, mas dará protagonismo ao inédito SUV Ora 5, que será feito no Brasil e chega antes.",Análise,2026-04-26T15:35:56+00:00,Elétrico,Elétrico,ora reestilizado estreia pequim antes ora hatch eletrico gwm ganha mudancas discretas visual cabine dara protagonismo inedito suv ora feito chega antes,22,19,3
https://motor1.uol.com.br/news/793910/geely-sistema-ihev-monjaro-china/,"irmão do Koleos, Geely Monjaro ganha novo sistema HEV de 45 km/l na China","SUV médio chinês dá boas dicas do que esperar para o Koleos nos próximos anos; veja como funciona o novo sistema I-HEV, capaz de rodar 45 km/l.",Análise,2026-04-26T15:00:00+00:00,Geral,Geral,irmao koleos geely monjaro ganha sistema hev china suv medio chines boas dicas esperar koleos proximos anos funciona sistema hev capaz rodar,22,19,2
https://motor1.uol.com.br/news/793911/chevrolet-tracker-hibrido-flex-segredo/,Segredo: Chevrolet Tracker será primeiro híbrido leve da marca no país,"A Chevrolet não se esqueceu de seus híbridos flex nacionais; o primeiro a chegar será o SUV compacto Tracker, que seguirá receita já vista nos Fiat e Jeep.",Análise,2026-04-26T14:00:00+00:00,Misto/Híbrido,Combustão/Híbrido,segredo chevrolet tracker primeiro hibrido leve pais chevrolet esqueceu hibridos flex nacionais primeiro chegar suv compacto tracker seguira receita vista fiat jeep,22,19,2
https://motor1.uol.com.br/news/794036/audi-q6-etron-2026-lancamento/,Novo Audi Q6 e-Tron 2026 está mais potente e parte de R$ 695.990,"O Audi Q6 e-tron 2026 chega ao Brasil com motor de 428 cv e aceleração de 0 a 100 km/h em 5,1s. Confira os preços; equipamentos e motorização do SUV.",Análise,2026-04-26T13:19:31+00:00,Geral,Geral,audi tron potente parte audi tron chega aceleracao confira equipamentos motorizacao suv,12,10,1
https://motor1.uol.com.br/news/793994/byd-confirma-novo-song-pro/,Oficial: BYD Song Pro flex chega em junho já de cara nova,Confirmado: o novo BYD Song Pro chega em junho com fabricação nacional em Camaçari e motor híbrido plug-in flex. Veja o que muda no SUV mais vendido da marca.,Análise,2026-04-25T13:44:41+00:00,Misto/Híbrido,Combustão/Híbrido,oficial byd song pro flex chega junho cara confirmado byd song pro chega junho fabricacao nacional camacari hibrido plug flex muda suv vendido,23,17,3
https://motor1.uol.com.br/news/794002/chery-confirma-exeed-no-brasil/,Mais uma: Chery confirma vinda da Exeed também para o Brasil,"O grupo Chery confirmou sua sexta marca no país, a Exeed; marca terá posicionamento premium e não deve ter laços com a Chery.",Análise,2026-04-25T13:13:45+00:00,Geral,Geral,chery confirma vinda exeed grupo chery confirmou sexta pais exeed posicionamento premium deve lacos chery,15,12,3
https://motor1.uol.com.br/news/794050/gwm-tank-300-hibrido-phev-flex-preco/,GWM Tank 300 2027 está nas lojas do Brasil com 1º sistema PHEV flex do mundo  ,"Jipe 4x4 chinês é o primeiro híbrido plug-in flex do mundo, com motor 2.0 turbo e sistema elétrico Hi4-T; tecnologia recebeu R$ 58,6 milhões de investimento.",Análise,2026-04-25T04:13:57+00:00,Misto/Híbrido,Combustão/Híbrido,gwm tank lojas sistema phev flex mundo jipe chines primeiro hibrido plug flex mundo turbo sistema eletrico tecnologia recebeu milhoes investimento,21,18,3
https://motor1.uol.com.br/news/794027/estreia-porsche-cayenne-coupe-electric/,Estreia mundial: Novo Porsche Cayenne Coupé Electric une luxo e 1.156 cv,"Novo Porsche Cayenne Coupé Electric tem até 1.156 cv, 1.500 Nm de torque, bateria de 113 kWh e estreia nova fase elétrica da marca; veja o vídeo.",Análise,2026-04-24T20:52:35+00:00,Misto/Híbrido,Combustão/Híbrido,estreia mundial porsche cayenne coupe electric une luxo porsche cayenne coupe electric torque bateria kwh estreia fase eletrica video,19,14,5
https://motor1.uol.com.br/news/794033/novo-gwm-ora-5-nacional/,Segredo: novo GWM Ora 5 será feito no Brasil com versões flex e híbridas,Novo GWM Ora 5 será produzido no Brasil com motor turbo flex e versões híbridas. SUV será destaque da fábrica de Aracruz.,Análise,2026-04-24T18:20:56+00:00,Combustão,Combustão/Híbrido,segredo gwm ora feito flex hibridas gwm ora produzido turbo flex hibridas suv destaque fabrica aracruz,16,12,3
https://motor1.uol.com.br/news/794017/mg4-urban-estreia-brasil-junho-producao/,MG4 Urban chega em junho e pode ser produzido no Brasil em 2026,"MG4 Urban chega ao Brasil em junho e pode ser produzido em 2026, com duas baterias e negociações em andamento no Ceará.",Análise,2026-04-24T17:45:00+00:00,Elétrico,Elétrico,urban chega junho produzido urban chega junho produzido duas baterias negociacoes andamento ceara,13,9,1
https://motor1.uol.com.br/news/794020/gwm-revela-tank-300-flex-brasil/,GWM Tank 300 será o primeiro híbrido flex da marca no Brasil,"Confira os detalhes do novo GWM Tank 300 PHEV flex. Com sistema feito pela engenharia brasileira, SUV estreia a tecnologia híbrida com etanol antes do Haval H6.",Análise,2026-04-24T16:45:36+00:00,Misto/Híbrido,Combustão/Híbrido,gwm tank primeiro hibrido flex confira detalhes gwm tank phev flex sistema feito engenharia brasileira suv estreia tecnologia hibrida etanol antes haval,22,19,3
https://motor1.uol.com.br/news/794013/yamaha-scotter-zr-hybrid-2026/,Yamaha lança ZR Hybrid Connected 2026 no Brasil por R$ 13.990,"Confira os detalhes da nova Yamaha ZR Hybrid Connected 2026. Com sistema híbrido leve (MHEV), pesa apenas 98 kg e chega com conectividade por R$ 13.990.",Análise,2026-04-24T16:07:44+00:00,Elétrico,Elétrico,yamaha lanca hybrid connected confira detalhes yamaha hybrid connected sistema hibrido leve mhev pesa apenas chega conectividade,17,14,1
https://motor1.uol.com.br/news/793989/byd-dolphin-hibrido-confirmado-2026-brasil/,BYD confirma Dolphin híbrido em 2026 e mantém King no Brasil,"BYD confirma Dolphin híbrido no Brasil e mantém o King, com produção local e expansão da linha no país.",Análise,2026-04-24T14:33:55+00:00,Elétrico,Elétrico,byd confirma dolphin hibrido mantem king byd confirma dolphin hibrido mantem king producao local expansao linha pais,17,11,4
https://motor1.uol.com.br/news/793933/omoda-jaecoo-brasil-carros-baratos/,"Com Omoda 4 e Jaecoo 5, marca da Chery terá SUVs ainda mais baratos em breve no Brasil","Durante o Salão de Pequim, Omoda & Jaecoo confirmou que já trabalha em carros menores e mais acessíveis que os vindouros Omoda 4 e Jaecoo 5.",Análise,2026-04-24T11:12:04+00:00,Geral,Geral,omoda jaecoo chery suvs ainda baratos breve durante salao pequim omoda jaecoo confirmou trabalha menores acessiveis vindouros omoda jaecoo,19,15,4
https://motor1.uol.com.br/news/793898/vendas-carros-china-mar%C3%A7o-2026/,Nissan Sentra garante 3º lugar entre mais vendidos na China em março,"Veja os carros mais vendidos da China em março de 2026. Tesla Model Y lidera, BYD volta ao topo e Nissan Sentra salta 25 posições para garantir o 3º lugar.",Análise,2026-04-24T11:01:11+00:00,Elétrico,Elétrico,nissan sentra garante lugar vendidos china marco vendidos china marco tesla model lidera byd volta topo nissan sentra salta posicoes garantir lugar,22,16,4
https://motor1.uol.com.br/news/793921/nissan-nx8-dongfeng-no-brasil/,"Nissan NX8, SUV chinês feito com a Dongfeng, estreia em Pequim e vem ao Brasil","SUV da Nissan feito com a Dongfeng aposta em versão elétrica e REEV para enfrentar BYD e GWM no Brasil; NX8 combina luxo, tecnologia e 1.450 km de autonomia.",Análise,2026-04-24T04:40:09+00:00,Elétrico,Elétrico,nissan suv chines feito dongfeng estreia pequim vem suv nissan feito dongfeng aposta eletrica reev enfrentar byd gwm combina luxo tecnologia autonomia,22,18,3
https://motor1.uol.com.br/news/793897/jetour-novo-suv-phev-brasil/,Jetour terá SUV PHEV contra Haval H6 e Song Plus no Brasil,"Chamado de X70L na China, novo SUV híbrido tem 4,81 m de comprimento e versões de 6 ou 7 lugares; sistema PHEV tem 360 cv e supera 800 km de alcance.",Análise,2026-04-23T21:19:56+00:00,Elétrico,Elétrico,jetour suv phev contra haval song plus chamado china suv hibrido comprimento lugares sistema phev supera alcance,17,15,3
https://motor1.uol.com.br/news/793889/vw-revela-sistema-hibrido-pleno/,VW revela sistema híbrido que estará no futuro T-Cross,"Chegando primeiro ao Golf e ao T-Roc, novidade está ligada ao câmbio e será flex e bem mais potente do que o atual 1.4 TSI; confira os detalhes técnicos.",Análise,2026-04-23T18:35:49+00:00,Misto/Híbrido,Combustão/Híbrido,revela sistema hibrido estara futuro cross chegando primeiro golf roc novidade ligada cambio flex bem potente atual tsi confira detalhes tecnicos,21,21,3
https://motor1.uol.com.br/news/793866/jetour-g700-brasil-4x4-phev/,"Jetour G700, jipão que atravessou rio na China, é confirmado para o Brasil","Equipado com um poderoso sistema híbrido plug-in (PHEV) de 761 cv, Jetour G700 vai disputar vendas com conterrâneos Denza B5 e Tank 700.",Análise,2026-04-23T14:37:38+00:00,Elétrico,Elétrico,jetour jipao atravessou rio china confirmado equipado poderoso sistema hibrido plug phev jetour disputar conterraneos denza tank,17,16,3
